{
  "$schema": "https://portable-closeout-framework.local/CLOSEOUT-CAPABILITY-LEDGER.schema.json",
  "schemaVersion": "closeout-capability-ledger.v1",
  "repo": {
    "name": "MLV-App",
    "root": ".",
    "defaultBranch": "master",
    "targetBranch": "master",
    "targetRemote": "fork",
    "remote": "fork",
    "currentHead": "132b74bc246222c23111530cade9e283a7e8e20f",
    "policyPath": "AGENTS.md",
    "sourceProfile": "Standard",
    "profileAdopted": "Standard",
    "ledgerOwner": "Codex"
  },
  "generatedAt": "2026-05-08T04:24:37-05:00",
  "lastVerifiedAt": "2026-05-08T04:25:56-05:00",
  "status": "STALE-2026-05-08",
  "ledgerProfile": "Standard",
  "frameworkArtifacts": {
    "historicalIncidentMap": "CLOSEOUT-HISTORICAL-INCIDENT-MAP.md",
    "crossMapComparison": "CLOSEOUT-CROSS-MAP-COMPARISON.md",
    "adjudicationProtocol": "CLOSEOUT-ADJUDICATION-PROTOCOL.md",
    "referenceMatrix": "CLOSEOUT-REFERENCE-MATRIX.md",
    "frameworkProfiles": "CLOSEOUT-FRAMEWORK-PROFILES.md",
    "capabilityLedgerSchema": "CLOSEOUT-CAPABILITY-LEDGER.schema.json",
    "capabilityLedger": "CLOSEOUT-CAPABILITY-LEDGER.json",
    "requirementsTrace": "CLOSEOUT-REQUIREMENTS-TRACE.md",
    "standard": "CLOSEOUT-STANDARD.md",
    "implementationPrompt": "CLOSEOUT-IMPLEMENTATION-PROMPT.md"
  },
  "statusDefinitions": {
    "YES": "Local evidence supports the capability through executable behavior, tests, contracts, drift checks, audit artifacts, or a scoped exception.",
    "PARTIAL": "Local evidence exists, but required behavior, coverage, enforcement, or selected-profile proof is incomplete.",
    "NO": "The capability is not implemented in this repo.",
    "UNAVAILABLE": "The capability cannot currently run in this repo or surface; an unavailable reason and recovery path are required.",
    "UNKNOWN": "The capability has not yet been assessed against local evidence."
  },
  "statusSummary": {
    "YES": 39,
    "PARTIAL": 5,
    "NO": 0,
    "UNAVAILABLE": 0,
    "UNKNOWN": 0
  },
  "capabilities": [
    {
      "capabilityId": "historical-incident-traceability",
      "title": "Historical incident traceability",
      "status": "PARTIAL",
      "profile": "Core",
      "decision": "Core MUST",
      "verification": {
        "claimBasis": "documentation-only",
        "verificationLevel": "docs-only",
        "summary": "Committed incident trace documents exist, but this packet forbids docs-only or generated-audit-only proof from supporting YES."
      },
      "evidencePaths": ["CLOSEOUT-HISTORICAL-INCIDENT-MAP.md", "CLOSEOUT-CROSS-MAP-COMPARISON.md"],
      "testPaths": [],
      "actorPaths": ["tools/closeout/work-block-complete.ps1"],
      "adapterPaths": [],
      "configPaths": ["closeout.config.json"],
      "contractPaths": ["tools/repo-hygiene/closeout.contract.json"],
      "driftCheckPaths": ["tools/repo_hygiene/test_repo_hygiene.py"],
      "auditArtifactPaths": [".claude-state/closeout/audits/audits.jsonl"],
      "sourceRequirementPaths": ["CLOSEOUT-REQUIREMENTS-TRACE.md"],
      "sourceRequirements": ["REQ-001", "REQ-002"],
      "relatedArtifacts": ["CLOSEOUT-REFERENCE-MATRIX.md"],
      "relatedCapabilities": ["requirements-trace-to-original-standard"],
      "blockers": [
        {
          "blockerId": "docs-only-proof",
          "kind": "proof-basis",
          "severity": "blocking",
          "description": "The row currently depends on committed prose and generated closeout audit paths rather than committed executable, test, contract, or scoped-exception proof.",
          "evidencePaths": ["CLOSEOUT-HISTORICAL-INCIDENT-MAP.md", "CLOSEOUT-CROSS-MAP-COMPARISON.md"],
          "recoveryCommand": "Add a committed contract or drift check that validates incident ids referenced by the trace artifacts."
        }
      ],
      "smallestNextStep": "Add a committed incident-trace validator that checks required incident ids and source links.",
      "repoSpecificNotes": "The trace artifacts are useful and committed, but they are prose evidence; this packet requires stronger proof before YES.",
      "lastVerifiedAt": "2026-05-08T04:00:37-05:00",
      "lastVerifiedBy": "Codex",
      "yesRequires": {
        "documentationOnlyIsSufficient": false,
        "executableBehaviorOrScopedException": false,
        "behavioralTestOrScopedException": false,
        "auditArtifactOrScopedException": false
      },
      "yesEvidenceBasis": []
    },
    {
      "capabilityId": "requirements-trace-to-original-standard",
      "title": "Requirements trace to original closeout rules",
      "status": "PARTIAL",
      "profile": "Core",
      "decision": "Core MUST",
      "verification": {
        "claimBasis": "documentation-only",
        "verificationLevel": "docs-only",
        "summary": "Committed requirements trace documents exist, but this packet forbids docs-only or generated-audit-only proof from supporting YES."
      },
      "evidencePaths": ["CLOSEOUT-REQUIREMENTS-TRACE.md", "CLOSEOUT-STANDARD.md"],
      "testPaths": [],
      "actorPaths": ["tools/closeout/work-block-complete.ps1"],
      "adapterPaths": [],
      "configPaths": ["closeout.config.json"],
      "contractPaths": ["tools/repo-hygiene/closeout.contract.json"],
      "driftCheckPaths": ["tools/repo_hygiene/test_repo_hygiene.py"],
      "auditArtifactPaths": [".claude-state/closeout/audits/audits.jsonl"],
      "sourceRequirementPaths": ["CLOSEOUT-REQUIREMENTS-TRACE.md"],
      "sourceRequirements": ["REQ-001", "REQ-031", "REQ-032"],
      "relatedArtifacts": ["CLOSEOUT-IMPLEMENTATION-PROMPT.md"],
      "relatedCapabilities": ["capability-ledger-schema", "clean-standard-non-smuggling"],
      "blockers": [
        {
          "blockerId": "docs-only-proof",
          "kind": "proof-basis",
          "severity": "blocking",
          "description": "The row currently depends on committed prose and generated closeout audit paths rather than committed executable, test, contract, or scoped-exception proof.",
          "evidencePaths": ["CLOSEOUT-REQUIREMENTS-TRACE.md", "CLOSEOUT-STANDARD.md"],
          "recoveryCommand": "Add a committed trace validator that checks requirement ids, row links, and profile mappings against the ledger."
        }
      ],
      "smallestNextStep": "Add a committed requirement-trace validator and wire it into the closeout test or drift-check suite.",
      "repoSpecificNotes": "The trace remains valuable as source material, but this packet treats it as prose until a committed validator exists.",
      "lastVerifiedAt": "2026-05-08T04:00:37-05:00",
      "lastVerifiedBy": "Codex",
      "yesRequires": {
        "documentationOnlyIsSufficient": false,
        "executableBehaviorOrScopedException": false,
        "behavioralTestOrScopedException": false,
        "auditArtifactOrScopedException": false
      },
      "yesEvidenceBasis": []
    },
    {
      "capabilityId": "capability-ledger-schema",
      "title": "Machine-readable capability ledger schema",
      "status": "YES",
      "profile": "Core",
      "decision": "Core MUST",
      "verification": {
        "claimBasis": "contract-drift-check",
        "verificationLevel": "contract-verified",
        "summary": "The schema defines strict status, evidence, blocker, and YES guardrails; this ledger is validated against it."
      },
      "evidencePaths": ["CLOSEOUT-CAPABILITY-LEDGER.schema.json", "CLOSEOUT-CAPABILITY-LEDGER.json"],
      "testPaths": [],
      "actorPaths": [],
      "adapterPaths": [],
      "configPaths": [],
      "contractPaths": ["CLOSEOUT-CAPABILITY-LEDGER.schema.json"],
      "driftCheckPaths": ["tools/repo_hygiene/test_repo_hygiene.py"],
      "auditArtifactPaths": [".claude-state/closeout/audits/audits.jsonl"],
      "sourceRequirementPaths": ["CLOSEOUT-REQUIREMENTS-TRACE.md"],
      "sourceRequirements": ["REQ-031"],
      "relatedArtifacts": ["CLOSEOUT-IMPLEMENTATION-PROMPT.md"],
      "relatedCapabilities": ["requirements-trace-to-original-standard"],
      "blockers": [],
      "smallestNextStep": "Keep schema validation in the closeout validation path as ledger rows evolve.",
      "repoSpecificNotes": "YES depends on local schema validation, not on the schema text alone.",
      "lastVerifiedAt": "2026-05-06T20:35:12-05:00",
      "lastVerifiedBy": "Codex",
      "yesRequires": {
        "documentationOnlyIsSufficient": false,
        "executableBehaviorOrScopedException": true,
        "behavioralTestOrScopedException": true,
        "auditArtifactOrScopedException": true
      },
      "yesEvidenceBasis": ["contract", "drift-check"]
    },
    {
      "capabilityId": "capability-ledger-populated",
      "title": "Capability ledger populated with frozen row inventory",
      "status": "YES",
      "profile": "Core",
      "decision": "Core MUST",
      "verification": {
        "claimBasis": "contract-drift-check",
        "verificationLevel": "contract-verified",
        "summary": "The committed ledger contains the frozen row inventory and a committed regression test verifies row presence, uniqueness, status summary parity, and YES proof guardrails."
      },
      "evidencePaths": ["CLOSEOUT-CAPABILITY-LEDGER.json"],
      "testPaths": ["tools/repo_hygiene/test_brokered_closeout.py"],
      "actorPaths": [],
      "adapterPaths": [],
      "configPaths": [],
      "contractPaths": ["CLOSEOUT-CAPABILITY-LEDGER.schema.json"],
      "driftCheckPaths": ["tools/repo_hygiene/test_brokered_closeout.py"],
      "auditArtifactPaths": [],
      "sourceRequirementPaths": ["CLOSEOUT-REQUIREMENTS-TRACE.md"],
      "sourceRequirements": ["REQ-031", "REQ-032"],
      "relatedArtifacts": ["CLOSEOUT-CAPABILITY-LEDGER.schema.json"],
      "relatedCapabilities": ["capability-ledger-schema", "clean-standard-non-smuggling"],
      "blockers": [],
      "smallestNextStep": "Keep FROZEN_CLOSEOUT_CAPABILITY_ROWS synchronized with any future shared row inventory change.",